{
  "schema_version": "1.0",
  "evidence_surface": "ENDPOINT_RENDER_REPRODUCED",
  "model": {
    "name": "example/model",
    "revision": "0000000000000000000000000000000000000000"
  },
  "runtime": {
    "name": "example-server",
    "commit": "0000000000000000000000000000000000000000",
    "entrypoint": "/tokenize",
    "custom_template_override": false
  },
  "target_texts": ["LATESYS"],
  "leading_system_text": "S",
  "markers": [
    {"role": "system", "open": "<s>", "close": "</s>"},
    {"role": "user", "open": "<u>", "close": "</u>"},
    {"role": "assistant", "open": "<a>"}
  ],
  "primary": {
    "messages": [
      {"role": "user", "content": "Q"},
      {"role": "system", "content": "LATESYS"},
      {"role": "user", "content": "Q2"}
    ],
    "rendered_text": "<u>Q LATESYS</u><u>Q2</u><a>"
  },
  "controls": {
    "no_system": {
      "rendered_text": "<u>Q</u><u>Q2</u><a>"
    },
    "leading_system": {
      "rendered_text": "<s>S</s><u>Q</u><a>"
    }
  },
  "classification": "WELDED_TO_USER"
}
